extraction;relation;before_root;root;after_root
aqueles seguem as transições de as redes sociais;seguem;;VERB-ROOT;
esta será um pouco diferente;será;AUX-cop;;
restrição de a imigração baseado em um sistema de mérito;baseado em;VERB-acl, ADP-case;;
ele iria permitir números tremendos;iria permitir;AUX-aux;VERB-ROOT;
ele iria permitir números tremendos de imigrantes legais;iria permitir;AUX-aux;VERB-ROOT;
Os novos gastos são alimentados por a grande conta bancária de Clinton;são alimentados por;AUX-aux:pass;VERB-ROOT;ADP-case
o máximo permitido $ 5000;permitido;VERB-acl;;
a equipe de transição utilizou o mesmo local para encontrar com os lobistas;utilizou o mesmo local para encontrar com;;VERB-ROOT;DET-det, ADJ-amod, NOUN-obj, SCONJ-mark, VERB-advcl, ADP-case
início de outubro convidando os representantes de a Uber;convidando os representantes de a;VERB-acl, DET-det, NOUN-obj, ADP-case, DET-det;;
a equipe de transição utilizou o mesmo local;utilizou;;VERB-ROOT;
O encontro foi originalmente marcado para o Clube Metropolitano Privado de Washington;foi originalmente marcado;AUX-aux:pass, ADV-advmod;VERB-ROOT;
O encontro foi originalmente marcado para o Clube Metropolitano Privado de Washington em a Rua H;foi originalmente marcado;AUX-aux:pass, ADV-advmod;VERB-ROOT;
O encontro foi originalmente marcado para o Clube Metropolitano Privado de Washington em a Rua H a uns quarteirões de distância;foi originalmente marcado;AUX-aux:pass, ADV-advmod;VERB-ROOT;
a indumentária aconselhada foi muito rígida;foi;AUX-cop;;
a indumentária foi muito rígida;foi;AUX-cop;;
os estudantes aprendem conteúdos científicos;aprendem;;VERB-ROOT;
os estudantes aprendem conteúdos científicos aplicando os;aprendem conteúdos científicos;;VERB-ROOT;NOUN-obj, ADJ-amod
a estação de metrô de o NoMa abriu em 2004;abriu;;VERB-ROOT;
Nós enfrentamos muita concorrência;enfrentamos;;VERB-ROOT;
o presidente de o Georgetown BID é Joe Sternlieb;é;AUX-cop;;
os passageiros iriam levar quatro minutos;iriam levar;AUX-aux;VERB-ROOT;
Uma testemunha contou a a polícia;contou a a;;VERB-ROOT;DET-det, DET-det
a vítima tinha atacado o suspeito em abril;tinha atacado o suspeito em;AUX-aux;VERB-ROOT;DET-det, NOUN-obj, ADP-case
a vítima tinha atacado o suspeito;tinha atacado;AUX-aux;VERB-ROOT;
Uma testemunha contou que a vítima tinha atacado o suspeito em abril a a polícia;contou que a vítima tinha atacado o suspeito em abril a;;VERB-ROOT;SCONJ-mark, DET-det, NOUN-nsubj, AUX-aux, VERB-ccomp, DET-det, NOUN-obj, ADP-case, NOUN-obl, ADP-case
apenas 11 por cento de os votos totais foram lançados antes de o dia eleitoral;foram lançados antes de o;AUX-aux:pass;VERB-ROOT;ADV-advmod, ADP-case, DET-det
Aquela quota tem aumentado firmemente;tem;AUX-aux;;
Aquela quota tem aumentado firmemente a o longo de os anos;tem aumentado firmemente;AUX-aux;VERB-ROOT;ADV-advmod
Khanzir deve ser um porco solitário;deve ser;;VERB-ROOT;AUX-cop
ele não está sempre sozinho;não está;ADV-advmod, AUX-cop;;
ele não está sozinho;não está;ADV-advmod, AUX-cop;;
Ela foi também acusada de ter tentado matar a sua filha de dois anos;foi também acusada de ter tentado matar a sua filha de;AUX-aux:pass, ADV-advmod;VERB-ROOT;SCONJ-mark, AUX-aux, VERB-xcomp, VERB-xcomp, DET-det, DET-det, NOUN-obj, ADP-case
Ela matou o Andre Price III;matou;;VERB-ROOT;
a sua filha é Angel;é;AUX-cop;;
Eu vou para a cadeia de qualquer maneira;vou para;;VERB-ROOT;ADP-case
O Sr Osborne inscreveu se em a agência americana de oradores;inscreveu se em;;VERB-ROOT;SCONJ-dep, ADP-case
a data para cortar o primeiro aço ajudaria a assegurar o novo investimento;ajudaria;;VERB-ROOT;
A promessa de as novas ordens de a Marinha Real para assegurar a construção de barcos de a indústria foi feita antes de o referendo de independência escocesa;foi feita;AUX-aux:pass;VERB-ROOT;
A promessa de as novas ordens de a Marinha Real para assegurar a construção de barcos de a indústria foi feita antes de o referendo de independência escocesa em 2014;foi feita;AUX-aux:pass;VERB-ROOT;
A promessa de as novas ordens de a Marinha Real para assegurar a construção de barcos de a indústria foi feita antes de o referendo em 2014;foi feita;AUX-aux:pass;VERB-ROOT;
A promessa de as novas ordens de a Marinha Real para assegurar a construção de barcos de a indústria Clyde foi feita em 2014;foi feita em;AUX-aux:pass;VERB-ROOT;ADP-case
este foi um nome top 50;foi;AUX-cop;;
este foi bebês com três vezes;foi bebês com;AUX-cop;NOUN-ROOT;ADP-case
a culpa seria de uma falha em a bateria;seria de;AUX-cop, ADP-case;;
A companhia sul - coreana substituiu o componente de fabricação própria;substituiu;;VERB-ROOT;
A companhia sul-coreana substituiu o componente de fabricação própria;substituiu;;VERB-ROOT;
A companhia sul-coreana substituiu o componente de fabricação própria por um de fabricação externa;substituiu o componente de fabricação própria por;;VERB-ROOT;DET-det, NOUN-obj, ADP-case, NOUN-nmod, ADJ-amod, ADP-case
a culpa seria de uma falha;seria de;AUX-cop, ADP-case;;
Vários analistas sugeriram que a Huawei;sugeriram que;;VERB-ROOT, SCONJ-ROOT;
Os telefones é Mate 9;é;AUX-cop;;
a internet durante os voos é pouco provável que influencie as escolhas de as companhias aéreas de os;é pouco provável que influencie as escolhas de as;AUX-cop, ADV-advmod;ADJ-ROOT;SCONJ-mark, VERB-csubj, DET-det, NOUN-obj, ADP-case, DET-det
a internet durante os voos é frequentemente falível;é;AUX-cop;;
a internet é falível;é;AUX-cop;;
a internet é falível durante os voos;é falível durante;AUX-cop;ADJ-ROOT;ADP-case
IAG tenham descoberto e possam oferecer algo vagamente confiável;tenham descoberto e possam oferecer;AUX-aux;VERB-ROOT;CCONJ-cc, VERB-conj, VERB-xcomp
a BA e a IAG o tenham descoberto;o tenham;PRON-det, AUX-aux;;
A empresa disse que seria de a responsabilidade de cada companhia aérea decidir a a BBC;disse que seria de a responsabilidade de cada companhia aérea decidir a;;VERB-ROOT;SCONJ-mark, AUX-cop, ADP-case, DET-det, NOUN-nsubj, ADP-case, DET-det, NOUN-nmod, ADJ-amod, VERB-ccomp, ADP-case
O esquema faz dinheiro;faz;;VERB-ROOT;
a agência de espionagem britânica é GCHQ;é;AUX-cop;;
O curso de 10 semanas foi certificado por a agência de espionagem britânica GCHQ;foi certificado por;AUX-aux:pass;VERB-ROOT;ADP-case
alguns especialistas de segurança levantaram questões acerca de a necessidade de o curso e de a intenção por trás dele;levantaram;;VERB-ROOT;
alguns especialistas de segurança levantaram questões acerca de a necessidade de o curso;levantaram;;VERB-ROOT;
alguns especialistas de segurança levantaram questões acerca de a necessidade de a intenção por trás dele;levantaram;;VERB-ROOT;
alguns especialistas de segurança levantaram questões;levantaram;;VERB-ROOT;
os jatos tinham sido vistos;tinham sido;AUX-aux, AUX-aux:pass;;
a China irá apresentar muitos outros equipamentos militares;irá apresentar;AUX-aux;VERB-ROOT;
a China irá apresentar esta semana;irá apresentar;AUX-aux;VERB-ROOT;
a China irá apresentar esta semana desde helicópteros de ataque até aeroplanos;irá apresentar esta semana desde;AUX-aux;VERB-ROOT;DET-det, NOUN-obj, ADP-case
os poucos arruinam tudo;arruinam;;VERB-ROOT;
em uma mensagem explica o porquê;explica;;VERB-ROOT;
Os eventos recentes são provavelmente os ataques de 21 de outubro;são;AUX-cop;;
Os eventos recentes são provavelmente os ataques de 21 de outubro que rapidamente derrubaram sites populares;são;AUX-cop;;
Os eventos recentes são provavelmente os ataques de 21 de outubro que rapidamente derrubaram sites populares como o Reddit;são;AUX-cop;;
Os eventos recentes são provavelmente os ataques de 21 de outubro que rapidamente derrubaram sites populares como o Reddit o Twitter e o Spotify bem como muitos outros;são;AUX-cop;;
Os eventos recentes são provavelmente os ataques que rapidamente derrubaram sites populares;são;AUX-cop;;
Os eventos recentes são provavelmente os ataques de 21 de outubro que rapidamente derrubaram sites populares como o Reddit o Twitter;são;AUX-cop;;
Os eventos recentes são provavelmente os ataques de 21 de outubro que rapidamente derrubaram sites populares como o Reddit o Spotify;são;AUX-cop;;
os ataques de 21 de outubro derrubaram sites populares como o Reddit;derrubaram;;VERB-ROOT;
Os eventos recentes são os ataques de 21 de outubro;são;AUX-cop;;
quantidades históricas de informação foram utilizadas para causar a ruptura;foram utilizadas para causar;AUX-aux:pass;VERB-ROOT;SCONJ-mark, VERB-advcl
quantidades históricas de informação foram utilizadas para causar a ruptura;foram utilizadas para;AUX-aux:pass;VERB-ROOT;SCONJ-mark
estes estão bem abaixo de os níveis necessários para manter o aumento de temperatura global abaixo de os 2 ° C;estão;AUX-cop;;
Um estudo de a UN sobre planos nacionais para reduzir o carbono diz que estes estão bem abaixo de os níveis necessários para manter o aumento de temperatura global abaixo de os 2°C;diz que estes estão bem abaixo de os níveis necessários para;;VERB-ROOT;SCONJ-mark, PRON-nsubj, AUX-cop, ADV-advmod, ADV-ccomp, ADP-case, DET-det, NOUN-obl, ADJ-amod, SCONJ-mark
a tecnologia para remover carbono de o ar será necessária;será;AUX-cop;;
a tecnologia para remover carbono de o ar será necessária para atingir os objetivos de Paris;será necessária para;AUX-cop;ADJ-ROOT;SCONJ-mark
o Acordo de Paris vai lentamente diminuir as alterações climáticas;vai lentamente diminuir;AUX-aux, ADV-advmod;VERB-ROOT;
a recente Emenda de Kigali vai reduzir os HFCs;vai reduzir;AUX-aux;VERB-ROOT;
o Acordo de Paris vai diminuir as alterações climáticas;vai diminuir;AUX-aux;VERB-ROOT;
Os investimentos nesta área aumentaram 6 % em 2015;aumentaram 6 % em;;VERB-ROOT;NUM-nummod, SYM-obj, ADP-case
Os investimentos nesta área aumentaram 6 %;aumentaram;;VERB-ROOT;
Os investimentos nesta área aumentaram em 2015;aumentaram;;VERB-ROOT;
Os investimentos aumentaram 6%;aumentaram;;VERB-ROOT;
Os investimentos aumentaram 6% em esta área;aumentaram 6% em;;VERB-ROOT;NUM-nummod, SYM-obj
Os investimentos aumentaram 6% em 2015;aumentaram 6% em;;VERB-ROOT;NUM-nummod, SYM-obj
Os investimentos aumentaram 6% para 221bn;aumentaram 6% para;;VERB-ROOT;NUM-nummod, SYM-obj
Isto colocará novos limites a a natureza de as mudanças ambientais;colocará;;VERB-ROOT;
Isto colocará novos limites a a natureza de as mudanças ambientais;colocará novos limites a;;VERB-ROOT;ADJ-amod, NOUN-obj, ADP-case
O indicador de este material meteorítico será elevado em níveis de o elemento irídio;será elevado em;AUX-aux:pass;VERB-ROOT;ADP-case
Os resultados desta fornecem um suporte adicional a a ideia;fornecem um suporte adicional a a;;VERB-ROOT;DET-det, NOUN-obj, ADJ-amod, ADP-case, DET-det
Os resultados desta experiência fornecem um suporte adicional;fornecem;;VERB-ROOT;
Os resultados de esta experiência fornecem um suporte adicional a a ideia;fornecem um suporte adicional a;;VERB-ROOT;DET-det, NOUN-obj, ADJ-amod, ADP-case
O RHS recolheu comentários enviados por alunos;recolheu comentários enviados por;;VERB-ROOT;NOUN-obj, VERB-acl, ADP-case
O RHS recolheu comentários enviados por professores;recolheu comentários enviados por;;VERB-ROOT;NOUN-obj, VERB-acl, ADP-case
O RHS recolheu comentários enviados por alunos e professores envolvidos em a experiência;recolheu;;VERB-ROOT;
O RHS recolheu comentários enviados por alunos;recolheu;;VERB-ROOT;
O RHS recolheu comentários enviados por professores;recolheu;;VERB-ROOT;
O RHS recolheu comentários;recolheu;;VERB-ROOT;
yuk' relacionado a a ideia;relacionado a a;PUNCT-punct, VERB-acl, ADP-case;;
o cabelo é normalmente colocado em um banho químico para remover por completo a cutícula;é normalmente colocado;AUX-aux:pass, ADV-advmod;VERB-ROOT;
o mercado internacional de cabelo tem tido sempre uma dimensão política;tem tido sempre;AUX-aux;VERB-ROOT;ADV-advmod
o mercado internacional de cabelo tem tido uma dimensão política Ao longo de a história;tem tido uma dimensão política;AUX-aux;VERB-ROOT;DET-det, NOUN-obj, ADJ-amod
o mercado internacional de cabelo tem tido uma dimensão política;tem tido;AUX-aux;VERB-ROOT;
A polícia de trânsito de Shenzhen tem optado por sanções não convencionais;tem optado por;AUX-aux;VERB-ROOT;ADP-case
debate tem sido sobre a identidade de homens brancos;tem sido sobre;AUX-aux, AUX-cop, ADP-case;;
Grande parte de o debate tem sido sobre a identidade de homens brancos;tem sido sobre;AUX-aux, AUX-cop, ADP-case;;
as pessoas poderiam votar em Trump;poderiam votar em;;VERB-ROOT;VERB-xcomp, ADP-case
eu perguntei - lhe;perguntei -;;VERB-ROOT;PUNCT-punct
alguém em a Sony Austrália estava de o tipo ' Olá por falar nisso ';estava;;VERB-ROOT;
alguém estava em a Sony Austrália;estava em;AUX-cop, ADP-case;;
Seagel fez manchetes;fez;;VERB-ROOT;
as ações de a Rússia em a Crimeia foram consideradas em 2014;foram consideradas;AUX-aux:pass;VERB-ROOT;
Um grande guitarrista deu um concerto;deu;;VERB-ROOT;
ele deu um concerto;deu;;VERB-ROOT;
Seage fez viagens regulares a a Rússica em os últimos anos;fez viagens regulares a a;;VERB-ROOT;NOUN-obj, ADJ-amod, ADP-case, DET-det
Seage fez viagens regulares;fez;;VERB-ROOT;
a capital é Belgrado;é;AUX-aux:pass;;
Um porta - voz de a polícia contou a a Associated Press mas que nenhum ferimento foi reportado;contou;;VERB-ROOT;
Um porta-voz de a polícia contou a a Associated Press;contou;;VERB-ROOT;
nenhum ferimento foi reportado;foi;AUX-aux:pass;;
Um porta-voz de a polícia contou que houve uma troca de palavras;contou;;VERB-ROOT;
Um porta-voz de a polícia contou que houve uma troca de palavras a a Associated Press;contou que houve uma troca de palavras a;;VERB-ROOT;SCONJ-mark, VERB-ccomp, DET-det, NOUN-obj, ADP-case, NOUN-nmod, ADP-case
Cuarón não estava em o grupo;não estava em;ADV-advmod, AUX-cop, ADP-case;;
último filme foi o vencedor de Óscar Gravity;foi;AUX-cop;;
uma luta começou depois de um grande grupo de pessoas que se identificaram como autoridades de o distrito chegarem a o grupo;começou;;VERB-ROOT;
uma luta começou depois de um grande grupo de pessoas que se identificaram como autoridades de o distrito chegarem a o grupo em a terça - feira;começou;;VERB-ROOT;
Os pesquisadores vêm investigando o potencial de contraceptivos hormonais;vêm investigando;;VERB-ROOT;VERB-xcomp
Os pesquisadores vêm investigando o potencial de contraceptivos hormonais masculinos;vêm investigando;;VERB-ROOT;VERB-xcomp
Este foi um passo em a longa jornada;foi;AUX-cop;;
Este foi um passo;foi;AUX-cop;;
Este foi um passo em a longa jornada;foi um passo em;AUX-cop, DET-det;NOUN-ROOT;ADP-case
Este foi um passo para encontrar a combinação certa para a contracepção hormonal masculina;foi um passo para;AUX-cop, DET-det;NOUN-ROOT;SCONJ-mark
muitos MLASs se oposeram a a nova legislação;se oposeram a;PRON-expl;VERB-ROOT;ADP-case
o DNA de o tumor poderá ajudar a explicar causas subjacentes de outros cânceres;poderá ajudar a explicar causas subjacentes de;;VERB-ROOT;VERB-xcomp, SCONJ-mark, VERB-xcomp, NOUN-obj, ADJ-amod, ADP-case
A análise mostra uma relação direta entre o número de cigarros;mostra uma relação direta entre;;VERB-ROOT;DET-det, NOUN-obj, ADJ-amod, ADP-case
A análise mostra uma relação direta entre o número de cigarros fumados durante a vida e o número de mutações;mostra;;VERB-ROOT;
A análise mostra uma relação direta entre o número de cigarros fumados durante a vida e o número de mutações em o DNA de o tumor;mostra;;VERB-ROOT;
eles não conseguiram encontrar esse mesmo padrão;não conseguiram;ADV-advmod;VERB-ROOT;
eles não conseguiram encontrar esse mesmo padrão em tecidos como a bexiga;não conseguiram;ADV-advmod;VERB-ROOT;
eles não conseguiram encontrar esse mesmo padrão em tecidos como a bexiga que não estão diretamente expostos;não conseguiram;ADV-advmod;VERB-ROOT;
tecidos como a bexiga não estão diretamente expostos;não estão;ADV-advmod, AUX-cop;;
tecidos como a bexiga não estão expostos;não estão;ADV-advmod, AUX-cop;;
eles não conseguiram encontrar;não conseguiram;ADV-advmod;VERB-ROOT;
A Sr ª Pugh recebeu tratamento;recebeu;;VERB-ROOT;
A Srª Pugh recebeu tratamento em os hospitais Papworth em Cambridgeshire;recebeu tratamento;;VERB-ROOT;NOUN-obj
Srª Pugh teve de deixar o experimento;teve de deixar;;VERB-ROOT;SCONJ-mark, VERB-xcomp
ela teve de deixar o experimento;teve de deixar;;VERB-ROOT;SCONJ-mark, VERB-xcomp
ela teve de deixar o experimento;teve;;VERB-ROOT;
Trudeau estenderá este este convite a o 45º presidente de os Estados Unidos;estenderá este este convite a;;VERB-ROOT;DET-obj, DET-det, NOUN-obj, ADP-case
um homem acusado de um apunhalamento fatal de uma adolescente em a sua escola em Abbotsford;acusado de;VERB-acl, ADP-case;;
eles têm mais perguntas de o que respostas acerca de um homem aparentemente sem - teto acusado de um apunhalamento fatal de uma adolescente;têm;;VERB-ROOT;
eles têm mais perguntas de o que respostas acerca de um homem aparentemente sem - teto acusado de um apunhalamento fatal de uma adolescente em a sua escola;têm;;VERB-ROOT;
eles têm mais perguntas de o que respostas acerca de um homem aparentemente sem - teto acusado de um apunhalamento fatal de uma adolescente em a sua escola em Abbotsford;têm;;VERB-ROOT;
eles têm perguntas;têm;;VERB-ROOT;
Klein divulgou vagos detalhes sobre a sua localização recente;divulgou vagos detalhes sobre;;VERB-ROOT;ADJ-amod, NOUN-obj, ADP-case
Klein não aparentava ter um histórico criminal;não aparentava;ADV-advmod;VERB-ROOT;
Klein divulgou vagos detalhes sobre a sua localização recente;divulgou;;VERB-ROOT;
Klein estava pouco comunicativo;estava;AUX-cop;;
Klein estava pouco comunicativo pouco cooperativo e relutante em sair de as celas;estava;AUX-cop;;
Klein estava pouco comunicativo pouco cooperativo e relutante em sair de as celas debaixo de o tribunal;estava;AUX-cop;;
A associação representa os agentes imobiliários de o estado;representa;;VERB-ROOT;
A associação representa os agentes imobiliários de o estado de Ontário;representa;;VERB-ROOT;
o Conselho Imobliliário de Ontario regula os agentes;regula;;VERB-ROOT;
o Conselho Imobliliário de Ontario é RECO;é;AUX-cop;;
RECO regula os agentes;regula;;VERB-ROOT;
o Conselho Imobliliário de Ontario regula os agentes em a jurisdição;regula os agentes em;;VERB-ROOT;DET-det, NOUN-obj, ADP-case
Ele gostaria de ver um maior cumprimento e investigação de poderes;gostaria de;;VERB-ROOT;SCONJ-mark
a RECO pode cobrar de um agente;pode cobrar de;;VERB-ROOT;VERB-xcomp, ADP-case
a multa máxima é $ 25000;é;AUX-cop;;
poluição asfixia os pulmões;asfixia;;VERB-ROOT;
a crescente classe média chinesa tem sido incomumente verbal;tem sido;AUX-aux, AUX-aux:pass;;
a crescente classe média chinesa tem sido incomumente verbal em as suas queixas acerca de o ar tóxico;tem sido;AUX-aux, AUX-cop;;
a crescente classe média chinesa tem sido incomumente verbal em as suas queixas acerca de o ar tóxico em cidades como Pequim que vê dia após dia poluição;tem sido;AUX-aux, AUX-cop;;
a crescente classe média chinesa tem sido incomumente verbal em as suas queixas acerca de o ar tóxico em cidades como Pequim que vê dia após dia poluição que asfixia os pulmões;tem sido;AUX-aux, AUX-cop;;
Ele poderia também esperar até o fim de o seu primeiro mandato;poderia também esperar até;;VERB-ROOT;ADV-advmod, VERB-xcomp, ADP-case
Ele poderia esperar até o fim de o seu primeiro mandato;poderia esperar até;;VERB-ROOT;VERB-xcomp, ADP-case
Ele poderia esperar para usar uma cláusula de o acordo de Paris para sair de o pacto;poderia esperar para;;VERB-ROOT;VERB-xcomp, SCONJ-mark
aliados estão procurando manter o foco em Trump;estão procurando manter o foco em;AUX-aux;VERB-ROOT;VERB-xcomp, DET-det, NOUN-obj, ADP-case
Clinton e aliados estão procurando manter o foco em Trump;estão procurando;AUX-aux;VERB-ROOT;
A mulher de Trump fez a sua primeira aparição pública desde a convenção;fez a sua primeira aparição pública desde;;VERB-ROOT;DET-det, DET-det, ADJ-amod, NOUN-obj, ADJ-amod, ADP-case
A mulher de Trump fez a sua primeira aparição pública desde a convenção Republicana;fez;;VERB-ROOT;
A mulher de Trump é Melania Trump;é;AUX-cop;;
a convenção é Republicana;é;AUX-cop;;
Melania Trump fez a sua primeira aparição pública desde a convenção Republicana;fez;;VERB-ROOT;
A mulher de Trump fez a sua primeira aparição pública desde a convenção Republicana;fez a sua primeira aparição pública desde;;VERB-ROOT;DET-det, DET-det, ADJ-amod, NOUN-obj, ADJ-amod, ADP-case
o maior conforto foi ver seus amigos;foi ver;AUX-cop;VERB-ROOT;
Estudantes como a Rai têm se encontrado com conselheiros;têm se encontrado;AUX-aux, PRON-expl;VERB-ROOT;
Estudantes como a Rai têm se encontrado com conselheiros;têm se encontrado com;AUX-aux, PRON-expl;VERB-ROOT;ADP-case
Estudantes como a Rai têm se encontrado para falar;têm se encontrado para;AUX-aux, PRON-expl;VERB-ROOT;SCONJ-mark
Este é um desastre;é;AUX-cop;;
Este é um desastre para os pacientes;é um desastre para;AUX-cop, DET-det;NOUN-ROOT;ADP-case
eles têm um livro de receitas;têm um livro de;;VERB-ROOT;DET-det, NOUN-obj, ADP-case
Os médicos não têm estas ferramentas;não têm;ADV-advmod;VERB-ROOT;
eles apenas têm um livro de receitas;apenas têm;ADV-advmod;VERB-ROOT;
eles apenas têm um livro de receitas e uma injeção;apenas têm;ADV-advmod;VERB-ROOT;
O diretor de revisão independente de a Polícia de Ontario definiu os termos para a sua análise desta semana;definiu;;VERB-ROOT;
O diretor de revisão independente de a Polícia de Ontario é Gerry McNeilly;é;AUX-cop;;
Gerry McNeilly definiu os termos para a sua análise desta semana;definiu;;VERB-ROOT;
O diretor de revisão independente de a Polícia de Ontario definiu os termos;definiu;;VERB-ROOT;
O diretor de revisão independente de a Polícia de Ontario definiu os termos para a sua análise de esta semana;definiu os termos para;;VERB-ROOT;DET-det, NOUN-obj, ADP-case
A inspeção também está investigando as publicações inflamatórias de setembro;também está investigando;ADV-advmod, AUX-aux;VERB-ROOT;
A inspeção também está investigando as publicações inflamatórias de setembro em o Facebook;também está investigando;ADV-advmod, AUX-aux;VERB-ROOT;
Os executivos também receberam a chamada remuneração por desempenho;também receberam;ADV-advmod;VERB-ROOT;
Os executivos receberam a chamada remuneração por corresponderem;receberam a chamada remuneração;;VERB-ROOT;DET-det, ADJ-amod, NOUN-obj
O orçamento anual é maior que $14 bilhões;é maior que;AUX-cop;ADJ-ROOT;SCONJ-case
O orçamento anual emprega mais de 6000 pessoas;emprega mais de;;VERB-ROOT;ADV-advmod, ADP-fixed
O orçamento anual é maior que $ 14 bilhões;é;AUX-cop;;
a última publicação em a internet é de 2013-2014 -;é de;AUX-cop, ADP-case;;
O governo federal reporta a remuneração de desempenho agregada e os níveis de bônus para cada departamento;reporta;;VERB-ROOT;
a última publicação é de 2013-2014;é de;AUX-cop, ADP-case;;
O total de remuneração foi de 15 milhões;foi de;AUX-cop, ADP-case;;
Gomery liderou a comissão de inquérito;liderou;;VERB-ROOT;
Gomery liderou a comissão de inquérito em o escândalo de o patrocínio federal;liderou a comissão de inquérito em;;VERB-ROOT;DET-det, NOUN-obj, ADP-case, NOUN-nmod, ADP-case
Isso levou a revelações em os últimos dois dias;levou a revelações em;;VERB-ROOT;ADP-case, NOUN-obj, ADP-case
outros jornalistas de Quebec foram indiciados por operações de vigilância de a polícia local;foram indiciados por;AUX-aux:pass;VERB-ROOT;ADP-case
Nossos celulares são muito mais que telefones;são muito mais que;AUX-cop, ADV-advmod;ADV-ROOT;SCONJ-fixed
Rogers introduziu um novo app;introduziu;;VERB-ROOT;
um novo app ajuda os clientes a monitorizar o seu uso de dados;ajuda os clientes a monitorizar o seu uso de;;VERB-ROOT;DET-det, NOUN-obj, SCONJ-mark, VERB-xcomp, DET-det, DET-det, NOUN-obj, ADP-case
um novo app ajuda os clientes;ajuda;;VERB-ROOT;
esta cepa ajuda com náuseas;ajuda com;;VERB-ROOT;ADP-case
Esta ajuda com náuseas;ajuda;;NOUN-ROOT;
as empresas ficam com dúvidas;ficam com;;VERB-ROOT;ADP-case
O ferro é um elemento essencial;é;AUX-cop;;
corpo produzir hemoglobina;produzir;;VERB-ROOT;
um elemento essencial é O ferro;é;AUX-cop;;
O ferro é um elemento requerido por o corpo;é um elemento;AUX-cop, DET-det;NOUN-ROOT;
O ferro é um elemento requerido para produzir hemoglobina;é um elemento;AUX-cop, DET-det;NOUN-ROOT;
as células de glóbulos vermelhos são responsáveis por transportar oxigênio para tecidos;são;AUX-cop;;
O ferro é um elemento essencial requerido por o corpo;é um elemento essencial requerido por;AUX-cop, DET-det;NOUN-ROOT;ADJ-amod, VERB-acl, ADP-case
O atual período de espera é de oito semanas;é de;AUX-cop, ADP-case;;
o seu feto precisava de uma cirurgia;precisava de;;VERB-ROOT;ADP-case
o seu feto tinha uma condição rara;tinha;;VERB-ROOT;
a futura mãe é Margaret Boemer;é;AUX-cop;;
O teratoma sacrococcígeo é um tumor;é;AUX-cop;;
Ela tem 84 anos;tem;;VERB-ROOT;
ela é uma voz positiva;é;AUX-cop;;
ela é uma voz forte;é;AUX-cop;;
A voz de ela deu uma volta a o mundo;deu uma volta a;;VERB-ROOT;DET-det, NOUN-obj, ADP-case
as redes sociais encheram de comentários;encheram de;;VERB-ROOT;ADP-case
eles foram pouco favoráveis;foram;AUX-cop;;
as redes sociais se encheram de comentários;se encheram de;PRON-expl;VERB-ROOT;ADP-case
Os detritos formaram um anel a o redor de o equador de a Terra;formaram;;VERB-ROOT;
Os detritos foram reunidos por a gravidade;foram reunidos por;AUX-aux:pass;VERB-ROOT;ADP-case
Os detritos formaram um anel;formaram;;VERB-ROOT;
Os detritos formaram um anel a o redor de o equador de a Terra;formaram um anel a;;VERB-ROOT;DET-det, NOUN-obj, ADP-case
