extraction;relation;before_root;root;after_root
a sua lei restringe o direito de voto;restringe;;VERB-ROOT;
Campbell andou pelas igrejas;andou;;VERB-ROOT;
sua lei restringe o direito de voto;restringe;;VERB-ROOT;
Campbell andou ensinando a as pessoas por as igrejas;andou ensinando a as pessoas por;;VERB-ROOT;VERB-xcomp, ADP-case, DET-det, NOUN-obj, ADP-case
Ele podia detectar os efeitos de a eleição;podia detectar;;VERB-ROOT;VERB-xcomp
Ele podia detectar os efeitos de a eleição e em a curiosa intersecção de novas ideias com antigas;podia detectar;;VERB-ROOT;VERB-xcomp
desacordo entre os dados econômicos e a retórica política é familiar;é;AUX-cop;;
o desenvolvimento institucional naqueles termos teve efeitos grandes e de longa duração;teve;;VERB-ROOT;
o desenvolvimento institucional naqueles termos teve efeitos grandes;teve;;VERB-ROOT;
o desenvolvimento institucional naqueles termos teve efeitos de longa duração;teve;;VERB-ROOT;
isso não descredita as semelhanças;não descredita;ADV-advmod;VERB-ROOT;
Karel demonstrou mais empatia;demonstrou mais;;VERB-ROOT;DET-det
Karel demonstrou mais empatia;demonstrou;;VERB-ROOT;
a crítica se tornou ácida;se tornou;PRON-expl;VERB-ROOT;
Karel demonstrou empatia;demonstrou;;VERB-ROOT;
Eles são artistas;são;AUX-cop;;
Zay e Zayion descreveram a gravação de a sua versão de Knuck If You Buck;descreveram;;VERB-ROOT;
Zay e Zayion descreveram a gravação de a sua versão de Knuck If You Buck em um laptop em casa;descreveram;;VERB-ROOT;
Os seus reaparecimentos sublinham o apelo de um bom desafio;sublinham o apelo de;;VERB-ROOT;DET-det, NOUN-obj, ADP-case
Os seus reaparecimentos sublinham o apelo de um bom desafio;sublinham;;VERB-ROOT;
Caplan descarta o voto retrospectivo;descarta;;VERB-ROOT;
a fundação lançou uma edição formatada de Zettel's Traum;lançou;;VERB-ROOT;
a fundação lançou uma edição formatada de Zettel's Traum;lançou;;VERB-ROOT;
a fundação lançou uma edição formatada de Zettel ' s Traum;lançou;;VERB-ROOT;
a fundação lançou uma edição formatada de Zettel ' s Traum Em 2010;lançou uma edição formatada de Zettel ' s Traum Em;;VERB-ROOT;DET-det, NOUN-obj, VERB-acl, ADP-case, PROPN-obl, PUNCT-punct, PROPN-appos, PROPN-flat:name, ADP-case
eu tentei a minha sorte;tentei;;VERB-ROOT;
Cada mapa em a exposição conta a sua própria história;conta;;VERB-ROOT;
Cada mapa em a exposição conta a sua própria história;conta;;VERB-ROOT;
Cada mapa conta a sua própria história;conta;;VERB-ROOT;
Cada mapa conta a sua própria história em a exposição;conta a sua própria história em;;VERB-ROOT;DET-det, DET-det, ADJ-amod, NOUN-obj, ADP-case
62 % de os eleitores apoiaram a saída de a UE;apoiaram;;VERB-ROOT;
O círculo eleitoral está em a área de o conselho de Kesteven de o Norte;está em;AUX-cop, ADP-case;;
A sua habilidade para obter respostas para os contribuintes trará uma profunda saudade;trará;;VERB-ROOT;
Christian Wolmar escreveu vários livros sobre história ferroviária;escreveu;;VERB-ROOT;
Christian Wolmar participará em a competição;participará em;;VERB-ROOT;ADP-case
Os democratas liberais esperam recuperá -lo com a sua candidata;esperam recuperá -lo com;;VERB-ROOT, VERB-ROOT;VERB-obj, ADP-case
Os democratas liberais representaram o abastado subúrbio;representaram;;VERB-ROOT;
a sua candidata é Sarah Olney;é;AUX-cop;;
Os democratas liberais representaram o abastado subúrbio até 2010;representaram o abastado subúrbio até;;VERB-ROOT;DET-det, ADJ-amod, NOUN-obj, ADP-case
a distanciada mulher de um chefe de governo lançou a sua campanha para tomar o lugar;lançou a sua campanha para tomar;;VERB-ROOT;DET-det, DET-det, NOUN-obj, SCONJ-mark, VERB-advcl
a distanciada mulher de um chefe de governo lançou a sua campanha;lançou;;VERB-ROOT;
a distanciada mulher de um chefe de governo lançou a sua campanha para tomar o lugar;lançou;;VERB-ROOT;
eu estou para lá de furioso;estou;;AUX-ROOT;
Ele estou para lá de furioso;estou;;AUX-ROOT;
Ele era completamente gracioso;era;AUX-cop;;
Ele era gracioso;era;AUX-cop;;
330 tripulantes estão a bordo de o navio;estão a;AUX-cop, ADP-case;;
muitos seriam desconhecedores de a sua história;seriam;AUX-cop;;
As pessoas foram mortas;foram;AUX-aux:pass;;
Uma central elétrica a carvão em Badarpur vai parar de operar por 10 dias;vai parar de operar por;AUX-aux;VERB-ROOT;SCONJ-mark, VERB-xcomp, ADP-case
Ele passou quatro anos com a rádio BBC World Service em a casa Bush;passou quatro anos com a rádio BBC World Service em;;VERB-ROOT;NUM-nummod, NOUN-obl, ADP-case, DET-det, NOUN-obl, PROPN-appos, PROPN-flat:name, PROPN-flat:name, ADP-case
Ele trabalhou para a BBC;trabalhou para;;VERB-ROOT;ADP-case
Ele trabalhou por uma década;trabalhou por;;VERB-ROOT;ADP-case
Uma de as suas muitas publicações de lamento em o Facebook tem uma linha;tem;;VERB-ROOT;
uma linha teria encantado Chris;teria encantado;AUX-aux;VERB-ROOT;
Uma de as suas muitas publicações de lamento em o Facebook tem uma linha que teria encantado Chris;tem;;VERB-ROOT;
Eles têm uma hipótese de redenção;têm uma hipótese de;;VERB-ROOT;DET-det, NOUN-obj, ADP-case
Eles têm uma hipótese de redenção;têm;;VERB-ROOT;
A África de o Sul está quase em um beco sem saída;está quase em;;AUX-ROOT;ADV-advmod, ADP-case
nós temos que conseguir alcançar suas expectativas;temos que conseguir alcançar;AUX-aux, SCONJ-mark;VERB-ROOT;VERB-xcomp
A África de o Sul está em um beco sem saída;está em;AUX-cop, ADP-case;;
Ele tem um jogo duro;tem;;VERB-ROOT;
Ele tem umas mãos suaves;tem;;VERB-ROOT;
Nós temos uma boa equipe;temos;;VERB-ROOT;
esta é uma oportunidade para nós levarmos o navio para a frente;é;AUX-cop;;
Você que resistir a isso;que resistir a;PRON-nsubj, VERB-acl:relcl, ADP-case;;
A Austrália estava com uma velocidade superior;estava com;AUX-cop, ADP-case;;
Uma vitória de Donald Trump tornaria o mundo preocupante;tornaria;;VERB-ROOT;
A Senhora Clinton tem uma reputação de um aspecto de falcão;tem uma reputação de;;VERB-ROOT;DET-det, NOUN-obj, ADP-case
A Senhora Clinton tem uma reputação de um aspecto de falcão;tem;;VERB-ROOT;
isto será temperado por uma opinião pública deprimida;será temperado por;AUX-aux:pass;VERB-ROOT;ADP-case
histórias chamadas de verdadeiras são publicadas em uma série de imagens significativas;são publicadas em;AUX-aux:pass;VERB-ROOT;ADP-case
Os artistas alcançam as pessoas;alcançam;;VERB-ROOT;
Os artistas alcançam as pessoas em o seu coração;alcançam as pessoas em;;VERB-ROOT;DET-det, NOUN-obj, ADP-case
Os seus títulos incluem embaixador global de a saúde;incluem;;VERB-ROOT;
Os seus títulos incluem embaixador global de a saúde de a cidade de Nova Iorque;incluem;;VERB-ROOT;
Os seus títulos menos comuns incluem embaixador global de a saúde de a cidade;incluem;;VERB-ROOT;
Posso fazer isso;fazer;VERB-xcomp;;
Eu queria vê -lo com eles;queria vê -lo com;;VERB-ROOT;VERB-xcomp, VERB-obj, ADP-case
pessoas estão apelando para o crédito;estão apelando para;AUX-aux;VERB-ROOT;ADP-case
uma mudança súbita em as circunstâncias pode levar a problemas de dívidas;pode levar a;;VERB-ROOT;VERB-xcomp, ADP-case
isso providencia insuficiente proteção a os trabalhadores americanos;providencia;;NOUN-ROOT;
isso providencia insuficiente proteção a os trabalhadores americanos;providencia insuficiente proteção a;;NOUN-ROOT;ADJ-amod, NOUN-obj, ADP-case
